TITLE,GENRE
Brothers in Arms: One Legendary Tank Regiment's Bloody War from D-Day to VE-Day,WW2
Big Week: The Biggest Air Battle of World War Two,WW2
The Battle of Britain,WW2
Dam Busters: The Race to Smash the Dams,WW2
Normandy 44: D-Day and the Battle for France,WW2
The Storm of War: A New History of the Second World War,WW2
Overlord: D-Day and the Battle for Normandy,WW2
"Das Reich: The March of the 2nd SS Panzer Division Through France, June 1944",WW2
Operation Pedestal: A Times Book of the Year 2021,WW2
Operation Biting,WW2
The Resistance: The French Fight Against the Nazis,WW2
The Crisis of German Ideology: Intellectual Origins of the Third Reich,WW2
Northern Ireland: A Journey,Travel
The Viking Isles,Travel
The Scottish Islands,Travel
The Gene: An Intimate History,Microhistory
The Earth Moved: On the Remarkable Achievements of Earthworms,Nature
Hands of Time: A Watchmaker's History,Microhistory
Worn: A People's History of Clothing,Microhistory
This Mortal Coil: A History of Death,Microhistory
"The Professor and the Madman: A Tale of Murder, Insanity and the Making of the Oxford English Dictionary",Microhistory
Beyond Measure: The Hidden History of Measurement from Cubits to Quantum Constants,Microhistory
Fowl Play: A History of the Chicken from Dinosaur to Dinner Plate,Microhistory
A Place For Everything: The Curious History of Alphabetical Order,Microhistory
Scent: A Natural History of Fragrance,Microhistory
A Cat's Tale: A Journey Through Feline History,Microhistory
The Fairy Tellers,Microhistory
Pockets: An Intimate History of How We Keep Things Close,Microhistory
"The Secret Life of Hidden Places: Concealed Rooms, Clandestine Passageways, and the Curious Minds That Made Them",Microhistory
Just My Type: A Book About Fonts,Microhistory
Bonk: The Curious Coupling of Science and Sex,Microhistory
Spice: The History of a Temptation,Microhistory
Tea: The Drink that Changed the World,Microhistory
"Stoned: Jewelry, Obsession, and How Desire Shapes the World†",Microhistory
A History of the Wife,Microhistory
The Potato: How the Humble Spud Rescued the Western World,Microhistory
"Marriage, a History: From Obedience to Intimacy or How Love Conquered Marriage",Microhistory
Coal: A Human History,Microhistory
The Botany of Desire: A Plant's-Eye View of the World,Microhistory
Flow: The Cultural Story of Menstruation,Microhistory
A Place For Everything: The Curious History of Alphabetical Order,Microhistory
Birth: The Surprising History of How We Are Born,Microhistory
Wanderlust: A History of Walking,Microhistory
Pigeons: The Fascinating Saga of the World's Most Revered and Reviled Bird,Microhistory
Gathering Moss: A Natural and Cultural History of Mosses,Microhistory
Hair: A Human History,Microhistory
Sand: The Never-Ending Story,Microhistory
Ivory Vikings: The Mystery of the Most Famous Chessmen in the World and the Woman Who Made Them,Microhistory
Support and Seduction: The History of Corsets and Bras,Microhistory
"The Anthropology of Turquoise: Reflections on Desert, Sea, Stone, and Sky",Microhistory
Sex at Dawn: The Prehistoric Origins of Modern Sexuality†,Microhistory
Weeds: How Vagabond Plants Gatecrashed Civilisation and Changed the Way We Think About Nature,Microhistory
"The Wave: In Pursuit of the Rogues, Freaks, and Giants of the Ocean",Microhistory
The Invention of News: How the World Came to Know About Itself,Microhistory
Ad Infinitum: A Biography of Latin,Microhistory
Misogyny: The World's Oldest Prejudice,Microhistory
Gentlemen's Blood: A History of Dueling from Swords at Dawn to Pistols at Dusk,Microhistory
Oxygen: The Molecule that Made the World,Microhistory
Clay: The History and Evolution of Humankind's Relationship with Earth's Most Primal Element,Microhistory
A History of Bombing ,Microhistory
Indigo: In Search of the Color That Seduced the World,Microhistory
The Pawprints of History: Dogs and the Course of Human Events,Microhistory
The Natural History of Unicorns,Microhistory
Why We Swim,Microhistory
Blue: In Search of Natureís Rarest Color,Microhistory
Yellow: The History of a Color,Microhistory
What We Talk About When We Talk About Books: The History and Future of Reading,Microhistory
The Reef: A Passionate History: The Great Barrier Reef from Captain Cook to Climate Change,Microhistory
The History of the Snowman: From the Ice Age to the Flea Market,Microhistory
Bicycle: The History,Microhistory
Light: A Radiant History from Creation to the Quantum Age,Microhistory
"The Rituals of Dinner: The Origins, Evolution, Eccentricities and Meaning of Table Manners",Microhistory
Feathers: The Evolution of a Natural Miracle,Microhistory
The Notebook: A History of Thinking on Paper,Microhistory
Want,Microhistory
Islands of Abandonment: Life in the Post-Human Landscape,Microhistory
Unlikeable Female Characters: The Women Pop Culture Wants You to Hate,Microhistory
Gloves: An Intimate History,Microhistory
This Mortal Coil: A History of Death,Microhistory
Jane Austen at Home,Microhistory
Jane Austen's England,Microhistory
Shadowlands,Scottish History
Whores in History: Prostitution in Western Society,Microhistory
The Tangled Tree: A Radical New History of Life,Microhistory
To Have And To Hold: An Intimate History Of Collectors and Collecting,Microhistory
Anatomies: A Cultural History of the Human Body,Microhistory
Heights of Fashion: A History of the Elevated Shoe,Microhistory
The Sixth Extinction: An Unnatural History,Microhistory
Proto: A New History of Our Ancient Past,History (Other)
Allies at War,WW2
The North Road,British History
The Nothing That is: A Natural History of Zero,Microhistory
